[
  {
    "module_id": "sentiment-code",
    "name": "Sentiment Analyzer (Built-in)",
    "version": "1.0.0",
    "provider_type": "code",
    "description": "Keyword-based sentiment analysis for English and Nepali. No ML required.",
    "language": [
      "en",
      "ne"
    ],
    "behavior": "annotate",
    "annotations_key": "sentiment",
    "config": {
      "entry_point": "modules.sentiment_analyzer"
    }
  },
  {
    "module_id": "sentiment-hf-multilingual",
    "name": "Multilingual Sentiment (HuggingFace)",
    "description": "BERT-based multilingual sentiment analysis model supporting multiple languages including Nepali",
    "version": "1.0.0",
    "provider_type": "huggingface",
    "config": {
      "model": "nlptown/bert-base-multilingual-uncased-sentiment",
      "task": "sentiment-analysis",
      "device": "cpu",
      "max_length": 512
    }
  },
  {
    "module_id": "language-detector-hf",
    "name": "Language Detection (HuggingFace)",
    "description": "XLM-RoBERTa-based language detection model supporting 20 languages",
    "version": "1.0.0",
    "provider_type": "huggingface",
    "config": {
      "model": "papluca/xlm-roberta-base-language-detection",
      "task": "text-classification",
      "device": "cpu",
      "max_length": 512
    }
  }
]